l40_squeezenet_tuned/tuning.2023-07-04T21:17+02:00.json
{"input": ["cuda -keys=cuda,gpu -arch=sm_89 -max_num_threads=1024 -thread_warp_size=32", "conv2d_nchw.cuda", [["TENSOR", [1, 3, 224, 224], "float32"], ["TENSOR", [64, 3, 3, 3], "float32"], [2, 2], [0, 0, 0, 0], [1, 1], "float32"], {}], "config": {"index": 779682, "code_hash": null, "entity": [["tile_f", "sp", [-1, 2, 2, 16]], ["tile_y", "sp", [-1, 3, 1, 1]], ["tile_x", "sp", [-1, 1, 3, 1]], ["tile_rc", "sp", [-1, 1]], ["tile_ry", "sp", [-1, 1]], ["tile_rx", "sp", [-1, 3]], ["auto_unroll_max_step", "ot", 512], ["unroll_explicit", "ot", 1]]}, "result": [[1.8558616119880874e-05], 0, 3.756706476211548, 1688498245.5951643], "version": 0.2, "tvm_version": "0.11.dev0"}
{"input": ["cuda -keys=cuda,gpu -arch=sm_89 -max_num_threads=1024 -thread_warp_size=32", "conv2d_nchw.cuda", [["TENSOR", [1, 3, 224, 224], "float32"], ["TENSOR", [64, 3, 3, 3], "float32"], [2, 2], [0, 0, 0, 0], [1, 1], "float32"], {}], "config": {"index": 274941, "code_hash": null, "entity": [["tile_f", "sp", [-1, 4, 2, 1]], ["tile_y", "sp", [-1, 1, 1, 3]], ["tile_x", "sp", [-1, 1, 1, 37]], ["tile_rc", "sp", [-1, 1]], ["tile_ry", "sp", [-1, 1]], ["tile_rx", "sp", [-1, 3]], ["auto_unroll_max_step", "ot", 512], ["unroll_explicit", "ot", 0]]}, "result": [[0.000746845901107011], 0, 3.932429552078247, 1688498246.9839747], "version": 0.2, "tvm_version": "0.11.dev0"}
{"input": ["cuda -keys=cuda,gpu -arch=sm_89 -max_num_threads=1024 -thread_warp_size=32", "conv2d_nchw.cuda", [["TENSOR", [1, 3, 224, 224], "float32"], ["TENSOR", [64, 3, 3, 3], "float32"], [2, 2], [0, 0, 0, 0], [1, 1], "float32"], {}], "config": {"index": 676096, "code_hash": null, "entity": [["tile_f", "sp", [-1, 1, 1, 8]], ["tile_y", "sp", [-1, 1, 1, 1]], ["tile_x", "sp", [-1, 3, 37, 1]], ["tile_rc", "sp", [-1, 3]], ["tile_ry", "sp", [-1, 3]], ["tile_rx", "sp", [-1, 3]], ["auto_unroll_max_step", "ot", 0], ["unroll_explicit", "ot", 1]]}, "result": [[1.1712310970696107e-05], 0, 3.2483012676239014, 1688498249.8293145], "version": 0.2, "tvm_version": "0.11.dev0"}
{"input": ["cuda -keys=cuda,gpu -arch=sm_89 -max_num_threads=1024 -thread_warp_size=32", "conv2d_nchw.cuda", [["TENSOR", [1, 3, 224, 224], "float32"], ["TENSOR", [64, 3, 3, 3], "float32"], [2, 2], [0, 0, 0, 0], [1, 1], "float32"], {}], "config": {"index": 492035, "code_hash": null, "entity": [["tile_f", "sp", [-1, 2, 16, 2]], ["tile_y", "sp", [-1, 3, 1, 1]], ["tile_x", "sp", [-1, 1, 3, 37]], ["tile_rc", "sp", [-1, 1]], ["tile_ry", "sp", [-1, 3]], ["tile_rx", "sp", [-1, 3]], ["auto_unroll_max_step", "ot", 1500], ["unroll_explicit", "ot", 0]]}, "result": [[0.00011208707720716327], 0, 4.719771385192871, 1688498252.7747285], "version": 0.2, "tvm_version": "0.11.dev0"}
{"input": ["cuda -keys=cuda,gpu -arch=sm_89 -max_num_threads=1024 -thread_warp_size=32", "conv2d_nchw.cuda", [["TENSOR", [1, 3, 224, 224], "float32"], ["TENSOR", [64, 3, 3, 3], "float32"], [2, 2], [0, 0, 0, 0], [1, 1], "float32"], {}], "config": {"index": 335836, "code_hash": null, "entity": [["tile_f", "sp", [-1, 16, 1, 1]], ["tile_y", "sp", [-1, 1, 3, 37]], ["tile_x", "sp", [-1, 1, 1, 3]], ["tile_rc", "sp", [-1, 3]], ["tile_ry", "sp", [-1, 3]], ["tile_rx", "sp", [-1, 3]], ["auto_unroll_max_step", "ot", 512], ["unroll_explicit", "ot", 0]]}, "result": [[0.0005372089477711243], 0, 3.6238317489624023, 1688498255.7718322], "version": 0.2, "tvm_version": "0.11.dev0"}
{"input": ["cuda -keys=cuda,gpu -arch=sm_89 -max_num_threads=1024 -thread_warp_size=32", "conv2d_nchw.cuda", [["TENSOR", [1, 3, 224, 224], "float32"], ["TENSOR", [64, 3, 3, 3], "float32"], [2, 2], [0, 0, 0, 0], [1, 1], "float32"], {}], "config": {"index": 653331, "code_hash": null, "entity": [["tile_f", "sp", [-1, 1, 16, 4]], ["tile_y", "sp", [-1, 3, 1, 1]], ["tile_x", "sp", [-1, 1, 37, 1]], ["tile_rc", "sp", [-1, 1]], ["tile_ry", "sp", [-1, 3]], ["tile_rx", "sp", [-1, 3]], ["auto_unroll_max_step", "ot", 0], ["unroll_explicit", "ot", 1]]}, "result": [[7.205313786916527e-06], 0, 3.1426734924316406, 1688498258.563], "version": 0.2, "tvm_version": "0.11.dev0"}
{"input": ["cuda -keys=cuda,gpu -arch=sm_89 -max_num_threads=1024 -thread_warp_size=32", "conv2d_nchw.cuda", [["TENSOR", [1, 3, 224, 224], "float32"], ["TENSOR", [64, 3, 3, 3], "float32"], [2, 2], [0, 0, 0, 0], [1, 1], "float32"], {}], "config": {"index": 421581, "code_hash": null, "entity": [["tile_f", "sp", [-1, 2, 2, 8]], ["tile_y", "sp", [-1, 37, 1, 3]], ["tile_x", "sp", [-1, 1, 1, 3]], ["tile_rc", "sp", [-1, 3]], ["tile_ry", "sp", [-1, 3]], ["tile_rx", "sp", [-1, 1]], ["auto_unroll_max_step", "ot", 1500], ["unroll_explicit", "ot", 0]]}, "result": [[0.017018671576271186], 0, 8.162474632263184, 1688498260.0927522], "version": 0.2, "tvm_version": "0.11.dev0"}
{"input": ["cuda -keys=cuda,gpu -arch=sm_89 -max_num_threads=1024 -thread_warp_size=32", "conv2d_nchw.cuda", [["TENSOR", [1, 3, 224, 224], "float32"], ["TENSOR", [64, 3, 3, 3], "float32"], [2, 2], [0, 0, 0, 0], [1, 1], "float32"], {}], "config": {"index": 980331, "code_hash": null, "entity": [["tile_f", "sp", [-1, 4, 1, 4]], ["tile_y", "sp", [-1, 1, 37, 1]], ["tile_x", "sp", [-1, 1, 1, 3]], ["tile_rc", "sp", [-1, 3]], ["tile_ry", "sp", [-1, 1]], ["tile_rx", "sp", [-1, 3]], ["auto_unroll_max_step", "ot", 1500], ["unroll_explicit", "ot", 1]]}, "result": [[2.772565048206978e-05], 0, 4.825537443161011, 1688498263.062176], "version": 0.2, "tvm_version": "0.11.dev0"}
{"input": ["cuda -keys=cuda,gpu -arch=sm_89 -max_num_threads=1024 -thread_warp_size=32", "conv2d_nchw.cuda", [["TENSOR", [1, 3, 224, 224], "float32"], ["TENSOR", [64, 3, 3, 3], "float32"], [2, 2], [0, 0, 0, 0], [1, 1], "float32"], {}], "config": {"index": 529380, "code_hash": null, "entity": [["tile_f", "sp", [-1, 32, 2, 1]], ["tile_y", "sp", [-1, 1, 3, 37]], ["tile_x", "sp", [-1, 1, 1, 3]], ["tile_rc", "sp", [-1, 1]], ["tile_ry", "sp", [-1, 1]], ["tile_rx", "sp", [-1, 1]], ["auto_unroll_max_step", "ot", 0], ["unroll_explicit", "ot", 1]]}, "result": [[0.0014734457871559633], 0, 3.5653297901153564, 1688498266.0215259], "version": 0.2, "tvm_version": "0.11.dev0"}
{"input": ["cuda -keys=cuda,gpu -arch=sm_89 -max_num_threads=1024 -thread_warp_size=32", "conv2d_nchw.cuda", [["TENSOR", [1, 3, 224, 224], "float32"], ["TENSOR", [64, 3, 3, 3], "float32"], [2, 2], [0, 0, 0, 0], [1, 1], "float32"], {}], "config": {"index": 495302, "code_hash": null, "entity": [["tile_f", "sp", [-1, 16, 2, 2]], ["tile_y", "sp", [-1, 1, 111, 1]], ["tile_x", "sp", [-1, 1, 1, 1]], ["tile_rc", "sp", [-1, 3]], ["tile_ry", "sp", [-1, 3]], ["tile_rx", "sp", [-1, 3]], ["auto_unroll_max_step", "ot", 1500], ["unroll_explicit", "ot", 0]]}, "result": [[2.4597490302356466e-05], 0, 4.586925268173218, 1688498268.932281], "version": 0.2, "tvm_version": "0.11.dev0"}
{"input": ["cuda -keys=cuda,gpu -arch=sm_89 -max_num_threads=1024 -thread_warp_size=32", "conv2d_nchw.cuda", [["TENSOR", [1, 3, 224, 224], "float32"], ["TENSOR", [64, 3, 3, 3], "float32"], [2, 2], [0, 0, 0, 0], [1, 1], "float32"], {}], "config": {"index": 848417, "code_hash": null, "entity": [["tile_f", "sp", [-1, 16, 4, 1]], ["tile_y", "sp", [-1, 1, 3, 1]], ["tile_x", "sp", [-1, 3, 37, 1]], ["tile_rc", "sp", [-1, 3]], ["tile_ry", "sp", [-1, 3]], ["tile_rx", "sp", [-1, 3]], ["auto_unroll_max_step", "ot", 512], ["unroll_explicit", "ot", 1]]}, "result": [[1.0724751167555411e-05], 0, 3.884934186935425, 1688498271.8191824], "version": 0.2, "tvm_version": "0.11.dev0"}
{"input": ["cuda -keys=cuda,gpu -arch=sm_89 -max_num_threads=1024 -thread_warp_size=32", "conv2d_nchw.cuda", [["TENSOR", [1, 3, 224, 224], "float32"], ["TENSOR", [64, 3, 3, 3], "float32"], [2, 2], [0, 0, 0, 0], [1, 1], "float32"], {}], "config": {"index": 668826, "code_hash": null, "entity": [["tile_f", "sp", [-1, 1, 8, 1]], ["tile_y", "sp", [-1, 37, 1, 3]], ["tile_x", "sp", [-1, 3, 1, 1]], ["tile_rc", "sp", [-1, 3]], ["tile_ry", "sp", [-1, 3]], ["tile_rx", "sp", [-1, 3]], ["auto_unroll_max_step", "ot", 0], ["unroll_explicit", "ot", 1]]}, "result": [[0.0002373051892526795], 0, 4.019995927810669, 1688498274.7628555], "version": 0.2, "tvm_version": "0.11.dev0"}
{"input": ["cuda -keys=cuda,gpu -arch=sm_89 -max_num_threads=1024 -thread_warp_size=32", "conv2d_nchw.cuda", [["TENSOR", [1, 3, 224, 224], "float32"], ["TENSOR", [64, 3, 3, 3], "float32"], [2, 2], [0, 0, 0, 0], [1, 1], "float32"], {}], "config": {"index": 790671, "code_hash": null, "entity": [["tile_f", "sp", [-1, 1, 16, 4]], ["tile_y", "sp", [-1, 1, 3, 1]], ["tile_x", "sp", [-1, 1, 1, 37]], ["tile_rc", "sp", [-1, 1]], ["tile_ry", "sp", [-1, 1]], ["tile_rx", "sp", [-1, 3]], ["auto_unroll_max_step", "ot", 512], ["unroll_explicit", "ot", 1]]}, "result": [[2.927991716085307e-05], 0, 4.045037269592285, 1688498277.6568491], "version": 0.2, "tvm_version": "0.11.dev0"}
{"input": ["cuda -keys=cuda,gpu -arch=sm_89 -max_num_threads=1024 -thread_warp_size=32", "conv2d_nchw.cuda", [["TENSOR", [1, 3, 224, 224], "float32"], ["TENSOR", [64, 3, 3, 3], "float32"], [2, 2], [0, 0, 0, 0], [1, 1], "float32"], {}], "config": {"index": 1006677, "code_hash": null, "entity": [["tile_f", "sp", [-1, 8, 8, 1]], ["tile_y", "sp", [-1, 1, 1, 1]], ["tile_x", "sp", [-1, 3, 1, 37]], ["tile_rc", "sp", [-1, 1]], ["tile_ry", "sp", [-1, 3]], ["tile_rx", "sp", [-1, 3]], ["auto_unroll_max_step", "ot", 1500], ["unroll_explicit", "ot", 1]]}, "result": [[0.00026513761907883955], 0, 10.693426132202148, 1688498280.6432536], "version": 0.2, "tvm_version": "0.11.dev0"}
{"input": ["cuda -keys=cuda,gpu -arch=sm_89 -max_num_threads=1024 -thread_warp_size=32", "conv2d_nchw.cuda", [["TENSOR", [1, 3, 224, 224], "float32"], ["TENSOR", [64, 3, 3, 3], "float32"], [2, 2], [0, 0, 0, 0], [1, 1], "float32"], {}], "config": {"index": 124451, "code_hash": null, "entity": [["tile_f", "sp", [-1, 2, 16, 2]], ["tile_y", "sp", [-1, 1, 1, 3]], ["tile_x", "sp", [-1, 1, 1, 37]], ["tile_rc", "sp", [-1, 3]], ["tile_ry", "sp", [-1, 1]], ["tile_rx", "sp", [-1, 3]], ["auto_unroll_max_step", "ot", 0], ["unroll_explicit", "ot", 0]]}, "result": [[0.0009671184013539652], 0, 2.77351975440979, 1688498281.9942715], "version": 0.2, "tvm_version": "0.11.dev0"}
{"input": ["cuda -keys=cuda,gpu -arch=sm_89 -max_num_threads=1024 -thread_warp_size=32", "conv2d_nchw.cuda", [["TENSOR", [1, 3, 224, 224], "float32"], ["TENSOR", [64, 3, 3, 3], "float32"], [2, 2], [0, 0, 0, 0], [1, 1], "float32"], {}], "config": {"index": 204654, "code_hash": null, "entity": [["tile_f", "sp", [-1, 4, 1, 2]], ["tile_y", "sp", [-1, 1, 3, 1]], ["tile_x", "sp", [-1, 1, 111, 1]], ["tile_rc", "sp", [-1, 3]], ["tile_ry", "sp", [-1, 1]], ["tile_rx", "sp", [-1, 1]], ["auto_unroll_max_step", "ot", 512], ["unroll_explicit", "ot", 0]]}, "result": [[1.9255013491576784e-05], 0, 3.4273130893707275, 1688498284.9301043], "version": 0.2, "tvm_version": "0.11.dev0"}
{"input": ["cuda -keys=cuda,gpu -arch=sm_89 -max_num_threads=1024 -thread_warp_size=32", "conv2d_nchw.cuda", [["TENSOR", [1, 3, 224, 224], "float32"], ["TENSOR", [64, 3, 3, 3], "float32"], [2, 2], [0, 0, 0, 0], [1, 1], "float32"], {}], "config": {"index": 495645, "code_hash": null, "entity": [["tile_f", "sp", [-1, 4, 8, 2]], ["tile_y", "sp", [-1, 1, 1, 37]], ["tile_x", "sp", [-1, 1, 1, 1]], ["tile_rc", "sp", [-1, 3]], ["tile_ry", "sp", [-1, 3]], ["tile_rx", "sp", [-1, 3]], ["auto_unroll_max_step", "ot", 1500], ["unroll_explicit", "ot", 0]]}, "result": [[6.239975154987052e-05], 0, 4.536658525466919, 1688498287.8754647], "version": 0.2, "tvm_version": "0.11.dev0"}
{"input": ["cuda -keys=cuda,gpu -arch=sm_89 -max_num_threads=1024 -thread_warp_size=32", "conv2d_nchw.cuda", [["TENSOR", [1, 3, 224, 224], "float32"], ["TENSOR", [64, 3, 3, 3], "float32"], [2, 2], [0, 0, 0, 0], [1, 1], "float32"], {}], "config": {"index": 431599, "code_hash": null, "entity": [["tile_f", "sp", [-1, 1, 2, 1]], ["tile_y", "sp", [-1, 37, 1, 1]], ["tile_x", "sp", [-1, 3, 1, 1]], ["tile_rc", "sp", [-1, 1]], ["tile_ry", "sp", [-1, 1]], ["tile_rx", "sp", [-1, 3]], ["auto_unroll_max_step", "ot", 1500], ["unroll_explicit", "ot", 0]]}, "result": [[0.005938563958579882], 0, 3.6606080532073975, 1688498289.2723825], "version": 0.2, "tvm_version": "0.11.dev0"}
{"input": ["cuda -keys=cuda,gpu -arch=sm_89 -max_num_threads=1024 -thread_warp_size=32", "conv2d_nchw.cuda", [["TENSOR", [1, 64, 55, 55], "float32"], ["TENSOR", [16, 64, 1, 1], "float32"], [1, 1], [0, 0, 0, 0], [1, 1], "float32"], {}], "config": {"index": 196323, "code_hash": null, "entity": [["tile_f", "sp", [-1, 8, 2, 1]], ["tile_y", "sp", [-1, 1, 1, 5]], ["tile_x", "sp", [-1, 1, 5, 11]], ["tile_rc", "sp", [-1, 1]], ["tile_ry", "sp", [-1, 1]], ["tile_rx", "sp", [-1, 1]], ["auto_unroll_max_step", "ot", 0], ["unroll_explicit", "ot", 1]]}, "result": [[0.00020785029457161546], 0, 3.604884386062622, 1688498298.5645204], "version": 0.2, "tvm_version": "0.11.dev0"}
{"input": ["cuda -keys=cuda,gpu -arch=sm_89 -max_num_threads=1024 -thread_warp_size=32", "conv2d_nchw.cuda", [["TENSOR", [1, 64, 55, 55], "float32"], ["TENSOR", [16, 64, 1, 1], "float32"], [1, 1], [0, 0, 0, 0], [1, 1], "float32"], {}], "config": {"index": 9128, "code_hash": null, "entity": [["tile_f", "sp", [-1, 1, 2, 4]], ["tile_y", "sp", [-1, 1, 5, 1]], ["tile_x", "sp", [-1, 1, 1, 1]], ["tile_rc", "sp", [-1, 2]], ["tile_ry", "sp", [-1, 1]], ["tile_rx", "sp", [-1, 1]], ["auto_unroll_max_step", "ot", 0], ["unroll_explicit", "ot", 0]]}, "result": [[8.009079029063996e-06], 0, 3.1074483394622803, 1688498301.347601], "version": 0.2, "tvm_version": "0.11.dev0"}
{"input": ["cuda -keys=cuda,gpu -arch=sm_89 -max_num_threads=1024 -thread_warp_size=32", "conv2d_nchw.cuda", [["TENSOR", [1, 64, 55, 55], "float32"], ["TENSOR", [16, 64, 1, 1], "float32"], [1, 1], [0, 0, 0, 0], [1, 1], "float32"], {}], "config": {"index": 96569, "code_hash": null, "entity": [["tile_f", "sp", [-1, 16, 1, 1]], ["tile_y", "sp", [-1, 5, 11, 1]], ["tile_x", "sp", [-1, 1, 1, 11]], ["tile_rc", "sp", [-1, 8]], ["tile_ry", "sp", [-1, 1]], ["tile_rx", "sp", [-1, 1]], ["auto_unroll_max_step", "ot", 512], ["unroll_explicit", "ot", 0]]}, "result": [[0.00033948550179438463], 0, 4.1305835247039795, 1688498304.3075051], "version": 0.2, "tvm_version": "0.11.dev0"}
{"input": ["cuda -keys=cuda,gpu -arch=sm_89 -max_num_threads=1024 -thread_warp_size=32", "conv2d_nchw.cuda", [["TENSOR", [1, 64, 55, 55], "float32"], ["TENSOR", [16, 64, 1, 1], "float32"], [1, 1], [0, 0, 0, 0], [1, 1], "float32"], {}], "config": {"index": 170752, "code_hash": null, "entity": [["tile_f", "sp", [-1, 1, 4, 2]], ["tile_y", "sp", [-1, 1, 5, 11]], ["tile_x", "sp", [-1, 1, 1, 1]], ["tile_rc", "sp", [-1, 32]], ["tile_ry", "sp", [-1, 1]], ["tile_rx", "sp", [-1, 1]], ["auto_unroll_max_step", "ot", 1500], ["unroll_explicit", "ot", 0]]}, "result": [[1.160998787001671e-05], 0, 3.8346803188323975, 1688498307.1377125], "version": 0.2, "tvm_version": "0.11.dev0"}
{"input": ["cuda -keys=cuda,gpu -arch=sm_89 -max_num_threads=1024 -thread_warp_size=32", "conv2d_nchw.cuda", [["TENSOR", [1, 64, 55, 55], "float32"], ["TENSOR", [16, 64, 1, 1], "float32"], [1, 1], [0, 0, 0, 0], [1, 1], "float32"], {}], "config": {"index": 7727, "code_hash": null, "entity": [["tile_f", "sp", [-1, 4, 1, 4]], ["tile_y", "sp", [-1, 1, 1, 11]], ["tile_x", "sp", [-1, 5, 1, 11]], ["tile_rc", "sp", [-1, 1]], ["tile_ry", "sp", [-1, 1]], ["tile_rx", "sp", [-1, 1]], ["auto_unroll_max_step", "ot", 0], ["unroll_explicit", "ot", 0]]}, "result": [[0.0068286743135593225], 0, 4.742257356643677, 1688498310.1379325], "version": 0.2, "tvm_version": "0.11.dev0"}
{"input": ["cuda -keys=cuda,gpu -arch=sm_89 -max_num_threads=1024 -thread_warp_size=32", "conv2d_nchw.cuda", [["TENSOR", [1, 64, 55, 55], "float32"], ["TENSOR", [16, 64, 1, 1], "float32"], [1, 1], [0, 0, 0, 0], [1, 1], "float32"], {}], "config": {"index": 144724, "code_hash": null, "entity": [["tile_f", "sp", [-1, 1, 1, 16]], ["tile_y", "sp", [-1, 1, 11, 1]], ["tile_x", "sp", [-1, 11, 1, 1]], ["tile_rc", "sp", [-1, 4]], ["tile_ry", "sp", [-1, 1]], ["tile_rx", "sp", [-1, 1]], ["auto_unroll_max_step", "ot", 1500], ["unroll_explicit", "ot", 0]]}, "result": [[1.5045124596242426e-05], 0, 3.610399007797241, 1688498313.067188], "version": 0.2, "tvm_version": "0.11.dev0"}
{"input": ["cuda -keys=cuda,gpu -arch=sm_89 -max_num_threads=1024 -thread_warp_size=32", "conv2d_nchw.cuda", [["TENSOR", [1, 64, 55, 55], "float32"], ["TENSOR", [16, 64, 1, 1], "float32"], [1, 1], [0, 0, 0, 0], [1, 1], "float32"], {}], "config": {"index": 354586, "code_hash": null, "entity": [["tile_f", "sp", [-1, 2, 1, 1]], ["tile_y", "sp", [-1, 55, 1, 1]], ["tile_x", "sp", [-1, 1, 1, 5]], ["tile_rc", "sp", [-1, 16]], ["tile_ry", "sp", [-1, 1]], ["tile_rx", "sp", [-1, 1]], ["auto_unroll_max_step", "ot", 1500], ["unroll_explicit", "ot", 1]]}, "result": [[0.0010579859593442622], 0, 7.194362640380859, 1688498316.0065646], "version": 0.2, "tvm_version": "0.11.dev0"}
{"input": ["cuda -keys=cuda,gpu -arch=sm_89 -max_num_threads=1024 -thread_warp_size=32", "conv2d_nchw.cuda", [["TENSOR", [1, 64, 55, 55], "float32"], ["TENSOR", [16, 64, 1, 1], "float32"], [1, 1], [0, 0, 0, 0], [1, 1], "float32"], {}], "config": {"index": 359603, "code_hash": null, "entity": [["tile_f", "sp", [-1, 2, 8, 1]], ["tile_y", "sp", [-1, 11, 1, 1]], ["tile_x", "sp", [-1, 11, 1, 1]], ["tile_rc", "sp", [-1, 32]], ["tile_ry", "sp", [-1, 1]], ["tile_rx", "sp", [-1, 1]], ["auto_unroll_max_step", "ot", 1500], ["unroll_explicit", "ot", 1]]}, "result": [[8.089682598864378e-05], 0, 5.8730998039245605, 1688498318.9363127], "version": 0.2, "tvm_version": "0.11.dev0"}
{"input": ["cuda -keys=cuda,gpu -arch=sm_89 -max_num_threads=1024 -thread_warp_size=32", "conv2d_nchw.cuda", [["TENSOR", [1, 64, 55, 55], "float32"], ["TENSOR", [16, 64, 1, 1], "float32"], [1, 1], [0, 0, 0, 0], [1, 1], "float32"], {}], "config": {"index": 357619, "code_hash": null, "entity": [["tile_f", "sp", [-1, 1, 8, 2]], ["tile_y", "sp", [-1, 1, 1, 5]], ["tile_x", "sp", [-1, 1, 5, 11]], ["tile_rc", "sp", [-1, 16]], ["tile_ry", "sp", [-1, 1]], ["tile_rx", "sp", [-1, 1]], ["auto_unroll_max_step", "ot", 1500], ["unroll_explicit", "ot", 1]]}, "result": [[3.9992019668607705e-05], 0, 4.007643938064575, 1688498321.8857412], "version": 0.2, "tvm_version": "0.11.dev0"}
{"input": ["cuda -keys=cuda,gpu -arch=sm_89 -max_num_threads=1024 -thread_warp_size=32", "conv2d_nchw.cuda", [["TENSOR", [1, 64, 55, 55], "float32"], ["TENSOR", [16, 64, 1, 1], "float32"], [1, 1], [0, 0, 0, 0], [1, 1], "float32"], {}], "config": {"index": 166453, "code_hash": null, "entity": [["tile_f", "sp", [-1, 1, 2, 4]], ["tile_y", "sp", [-1, 55, 1, 1]], ["tile_x", "sp", [-1, 1, 1, 5]], ["tile_rc", "sp", [-1, 16]], ["tile_ry", "sp", [-1, 1]], ["tile_rx", "sp", [-1, 1]], ["auto_unroll_max_step", "ot", 1500], ["unroll_explicit", "ot", 0]]}, "result": [[0.000983051799265606], 0, 5.822930335998535, 1688498324.8135028], "version": 0.2, "tvm_version": "0.11.dev0"}
{"input": ["cuda -keys=cuda,gpu -arch=sm_89 -max_num_threads=1024 -thread_warp_size=32", "conv2d_nchw.cuda", [["TENSOR", [1, 64, 55, 55], "float32"], ["TENSOR", [16, 64, 1, 1], "float32"], [1, 1], [0, 0, 0, 0], [1, 1], "float32"], {}], "config": {"index": 309838, "code_hash": null, "entity": [["tile_f", "sp", [-1, 8, 1, 2]], ["tile_y", "sp", [-1, 1, 5, 1]], ["tile_x", "sp", [-1, 1, 1, 5]], ["tile_rc", "sp", [-1, 64]], ["tile_ry", "sp", [-1, 1]], ["tile_rx", "sp", [-1, 1]], ["auto_unroll_max_step", "ot", 512], ["unroll_explicit", "ot", 1]]}, "result": [[1.0373603050137888e-05], 0, 5.839989185333252, 1688498327.6480398], "version": 0.2, "tvm_version": "0.11.dev0"}
{"input": ["cuda -keys=cuda,gpu -arch=sm_89 -max_num_threads=1024 -thread_warp_size=32", "conv2d_nchw.cuda", [["TENSOR", [1, 64, 55, 55], "float32"], ["TENSOR", [16, 64, 1, 1], "float32"], [1, 1], [0, 0, 0, 0], [1, 1], "float32"], {}], "config": {"index": 14205, "code_hash": null, "entity": [["tile_f", "sp", [-1, 1, 4, 4]], ["tile_y", "sp", [-1, 11, 5, 1]], ["tile_x", "sp", [-1, 1, 1, 5]], ["tile_rc", "sp", [-1, 2]], ["tile_ry", "sp", [-1, 1]], ["tile_rx", "sp", [-1, 1]], ["auto_unroll_max_step", "ot", 0], ["unroll_explicit", "ot", 0]]}, "result": [[0.00010138495994962217], 0, 3.5595550537109375, 1688498330.6053808], "version": 0.2, "tvm_version": "0.11.dev0"}
{"input": ["cuda -keys=cuda,gpu -arch=sm_89 -max_num_threads=1024 -thread_warp_size=32", "conv2d_nchw.cuda", [["TENSOR", [1, 64, 55, 55], "float32"], ["TENSOR", [16, 64, 1, 1], "float32"], [1, 1], [0, 0, 0, 0], [1, 1], "float32"], {}], "config": {"index": 162256, "code_hash": null, "entity": [["tile_f", "sp", [-1, 1, 1, 8]], ["tile_y", "sp", [-1, 1, 11, 5]], ["tile_x", "sp", [-1, 5, 1, 1]], ["tile_rc", "sp", [-1, 16]], ["tile_ry", "sp", [-1, 1]], ["tile_rx", "sp", [-1, 1]], ["auto_unroll_max_step", "ot", 1500], ["unroll_explicit", "ot", 0]]}, "result": [[2.4730760501139658e-05], 0, 3.969635248184204, 1688498333.4948416], "version": 0.2, "tvm_version": "0.11.dev0"}
{"input": ["cuda -keys=cuda,gpu -arch=sm_89 -max_num_threads=1024 -thread_warp_size=32", "conv2d_nchw.cuda", [["TENSOR", [1, 64, 55, 55], "float32"], ["TENSOR", [16, 64, 1, 1], "float32"], [1, 1], [0, 0, 0, 0], [1, 1], "float32"], {}], "config": {"index": 233116, "code_hash": null, "entity": [["tile_f", "sp", [-1, 2, 1, 2]], ["tile_y", "sp", [-1, 1, 5, 1]], ["tile_x", "sp", [-1, 1, 1, 1]], ["tile_rc", "sp", [-1, 32]], ["tile_ry", "sp", [-1, 1]], ["tile_rx", "sp", [-1, 1]], ["auto_unroll_max_step", "ot", 0], ["unroll_explicit", "ot", 1]]}, "result": [[9.41568065710234e-06], 0, 3.2064695358276367, 1688498336.2923527], "version": 0.2, "tvm_version": "0.11.dev0"}
{"input": ["cuda -keys=cuda,gpu -arch=sm_89 -max_num_threads=1024 -thread_warp_size=32", "conv2d_nchw.cuda", [["TENSOR", [1, 64, 55, 55], "float32"], ["TENSOR", [16, 64, 1, 1], "float32"], [1, 1], [0, 0, 0, 0], [1, 1], "float32"], {}], "config": {"index": 361068, "code_hash": null, "entity": [["tile_f", "sp", [-1, 8, 2, 1]], ["tile_y", "sp", [-1, 1, 1, 11]], ["tile_x", "sp", [-1, 1, 5, 1]], ["tile_rc", "sp", [-1, 32]], ["tile_ry", "sp", [-1, 1]], ["tile_rx", "sp", [-1, 1]], ["auto_unroll_max_step", "ot", 1500], ["unroll_explicit", "ot", 1]]}, "result": [[9.635145625949701e-06], 0, 5.088453054428101, 1688498339.1912086], "version": 0.2, "tvm_version": "0.11.dev0"}
{"input": ["cuda -keys=cuda,gpu -arch=sm_89 -max_num_threads=1024 -thread_warp_size=32", "conv2d_nchw.cuda", [["TENSOR", [1, 64, 55, 55], "float32"], ["TENSOR", [16, 64, 1, 1], "float32"], [1, 1], [0, 0, 0, 0], [1, 1], "float32"], {}], "config": {"index": 208736, "code_hash": null, "entity": [["tile_f", "sp", [-1, 1, 1, 8]], ["tile_y", "sp", [-1, 1, 11, 5]], ["tile_x", "sp", [-1, 1, 5, 1]], ["tile_rc", "sp", [-1, 4]], ["tile_ry", "sp", [-1, 1]], ["tile_rx", "sp", [-1, 1]], ["auto_unroll_max_step", "ot", 0], ["unroll_explicit", "ot", 1]]}, "result": [[1.0758480932026399e-05], 0, 3.149923086166382, 1688498342.0133636], "version": 0.2, "tvm_version": "0.11.dev0"}
{"input": ["cuda -keys=cuda,gpu -arch=sm_89 -max_num_threads=1024 -thread_warp_size=32", "conv2d_nchw.cuda", [["TENSOR", [1, 64, 55, 55], "float32"], ["TENSOR", [16, 64, 1, 1], "float32"], [1, 1], [0, 0, 0, 0], [1, 1], "float32"], {}], "config": {"index": 79971, "code_hash": null, "entity": [["tile_f", "sp", [-1, 1, 1, 8]], ["tile_y", "sp", [-1, 1, 1, 11]], ["tile_x", "sp", [-1, 1, 5, 11]], ["tile_rc", "sp", [-1, 2]], ["tile_ry", "sp", [-1, 1]], ["tile_rx", "sp", [-1, 1]], ["auto_unroll_max_step", "ot", 512], ["unroll_explicit", "ot", 0]]}, "result": [[0.004217022750656168], 0, 5.048353910446167, 1688498344.979161], "version": 0.2, "tvm_version": "0.11.dev0"}
{"input": ["cuda -keys=cuda,gpu -arch=sm_89 -max_num_threads=1024 -thread_warp_size=32", "conv2d_nchw.cuda", [["TENSOR", [1, 64, 55, 55], "float32"], ["TENSOR", [16, 64, 1, 1], "float32"], [1, 1], [0, 0, 0, 0], [1, 1], "float32"], {}], "config": {"index": 34890, "code_hash": null, "entity": [["tile_f", "sp", [-1, 1, 4, 4]], ["tile_y", "sp", [-1, 1, 5, 1]], ["tile_x", "sp", [-1, 1, 5, 11]], ["tile_rc", "sp", [-1, 8]], ["tile_ry", "sp", [-1, 1]], ["tile_rx", "sp", [-1, 1]], ["auto_unroll_max_step", "ot", 0], ["unroll_explicit", "ot", 0]]}, "result": [[2.0879525418152625e-05], 0, 3.281175374984741, 1688498347.9037201], "version": 0.2, "tvm_version": "0.11.dev0"}
{"input": ["cuda -keys=cuda,gpu -arch=sm_89 -max_num_threads=1024 -thread_warp_size=32", "conv2d_nchw.cuda", [["TENSOR", [1, 64, 55, 55], "float32"], ["TENSOR", [16, 64, 1, 1], "float32"], [1, 1], [0, 0, 0, 0], [1, 1], "float32"], {}], "config": {"index": 207446, "code_hash": null, "entity": [["tile_f", "sp", [-1, 2, 1, 1]], ["tile_y", "sp", [-1, 5, 11, 1]], ["tile_x", "sp", [-1, 11, 1, 1]], ["tile_rc", "sp", [-1, 4]], ["tile_ry", "sp", [-1, 1]], ["tile_rx", "sp", [-1, 1]], ["auto_unroll_max_step", "ot", 0], ["unroll_explicit", "ot", 1]]}, "result": [[0.00015340941682509505], 0, 3.553595542907715, 1688498350.8297992], "version": 0.2, "tvm_version": "0.11.dev0"}
{"input": ["cuda -keys=cuda,gpu -arch=sm_89 -max_num_threads=1024 -thread_warp_size=32", "conv2d_nchw.cuda", [["TENSOR", [1, 64, 55, 55], "float32"], ["TENSOR", [16, 64, 1, 1], "float32"], [1, 1], [0, 0, 0, 0], [1, 1], "float32"], {}], "config": {"index": 99229, "code_hash": null, "entity": [["tile_f", "sp", [-1, 16, 1, 1]], ["tile_y", "sp", [-1, 55, 1, 1]], ["tile_x", "sp", [-1, 5, 1, 1]], ["tile_rc", "sp", [-1, 16]], ["tile_ry", "sp", [-1, 1]], ["tile_rx", "sp", [-1, 1]], ["auto_unroll_max_step", "ot", 512], ["unroll_explicit", "ot", 0]]}, "result": [[0.005687665201413427], 0, 4.056858539581299, 1688498353.8201725], "version": 0.2, "tvm_version": "0.11.dev0"}
{"input": ["cuda -keys=cuda,gpu -arch=sm_89 -max_num_threads=1024 -thread_warp_size=32", "conv2d_nchw.cuda", [["TENSOR", [1, 64, 55, 55], "float32"], ["TENSOR", [16, 64, 1, 1], "float32"], [1, 1], [0, 0, 0, 0], [1, 1], "float32"], {}], "config": {"index": 84325, "code_hash": null, "entity": [["tile_f", "sp", [-1, 2, 4, 1]], ["tile_y", "sp", [-1, 1, 1, 5]], ["tile_x", "sp", [-1, 1, 11, 1]], ["tile_rc", "sp", [-1, 4]], ["tile_ry", "sp", [-1, 1]], ["tile_rx", "sp", [-1, 1]], ["auto_unroll_max_step", "ot", 512], ["unroll_explicit", "ot", 0]]}, "result": [[5.530889636489775e-06], 0, 3.1497740745544434, 1688498356.6241527], "version": 0.2, "tvm_version": "0.11.dev0"}
{"input": ["cuda -keys=cuda,gpu -arch=sm_89 -max_num_threads=1024 -thread_warp_size=32", "conv2d_nchw.cuda", [["TENSOR", [1, 64, 55, 55], "float32"], ["TENSOR", [16, 64, 1, 1], "float32"], [1, 1], [0, 0, 0, 0], [1, 1], "float32"], {}], "config": {"index": 36650, "code_hash": null, "entity": [["tile_f", "sp", [-1, 1, 2, 1]], ["tile_y", "sp", [-1, 5, 11, 1]], ["tile_x", "sp", [-1, 5, 1, 1]], ["tile_rc", "sp", [-1, 16]], ["tile_ry", "sp", [-1, 1]], ["tile_rx", "sp", [-1, 1]], ["auto_unroll_max_step", "ot", 0], ["unroll_explicit", "ot", 0]]}, "result": [[1.4087703663841834e-05], 0, 3.2988789081573486, 1688498359.4647849], "version": 0.2, "tvm_version": "0.11.dev0"}
{"input": ["cuda -keys=cuda,gpu -arch=sm_89 -max_num_threads=1024 -thread_warp_size=32", "conv2d_nchw.cuda", [["TENSOR", [1, 64, 55, 55], "float32"], ["TENSOR", [16, 64, 1, 1], "float32"], [1, 1], [0, 0, 0, 0], [1, 1], "float32"], {}], "config": {"index": 315576, "code_hash": null, "entity": [["tile_f", "sp", [-1, 2, 1, 2]], ["tile_y", "sp", [-1, 1, 55, 1]], ["tile_x", "sp", [-1, 55, 1, 1]], ["tile_rc", "sp", [-1, 1]], ["tile_ry", "sp", [-1, 1]], ["tile_rx", "sp", [-1, 1]], ["auto_unroll_max_step", "ot", 1500], ["unroll_explicit", "ot", 1]]}, "result": [[7.934233333333333e-05], 0, 3.8075907230377197, 1688498362.3870237], "version": 0.2, "tvm_version": "0.11.dev0"}
{"input": ["cuda -keys=cuda,gpu -arch=sm_89 -max_num_threads=1024 -thread_warp_size=32", "conv2d_nchw.cuda", [["TENSOR", [1, 64, 55, 55], "float32"], ["TENSOR", [16, 64, 1, 1], "float32"], [1, 1], [0, 0, 0, 0], [1, 1], "float32"], {}], "config": {"index": 190886, "code_hash": null, "entity": [["tile_f", "sp", [-1, 1, 1, 8]], ["tile_y", "sp", [-1, 5, 1, 11]], ["tile_x", "sp", [-1, 1, 5, 1]], ["tile_rc", "sp", [-1, 1]], ["tile_ry", "sp", [-1, 1]], ["tile_rx", "sp", [-1, 1]], ["auto_unroll_max_step", "ot", 0], ["unroll_explicit", "ot", 1]]}, "result": [[0.0005212465713822194], 0, 3.7431628704071045, 1688498365.358505], "version": 0.2, "tvm_version": "0.11.dev0"}
{"input": ["cuda -keys=cuda,gpu -arch=sm_89 -max_num_threads=1024 -thread_warp_size=32", "conv2d_nchw.cuda", [["TENSOR", [1, 64, 55, 55], "float32"], ["TENSOR", [16, 64, 1, 1], "float32"], [1, 1], [0, 0, 0, 0], [1, 1], "float32"], {}], "config": {"index": 21724, "code_hash": null, "entity": [["tile_f", "sp", [-1, 1, 8, 2]], ["tile_y", "sp", [-1, 1, 1, 11]], ["tile_x", "sp", [-1, 1, 11, 1]], ["tile_rc", "sp", [-1, 4]], ["tile_ry", "sp", [-1, 1]], ["tile_rx", "sp", [-1, 1]], ["auto_unroll_max_step", "ot", 0], ["unroll_explicit", "ot", 0]]}, "result": [[8.297520263984026e-06], 0, 3.1413118839263916, 1688498368.1482468], "version": 0.2, "tvm_version": "0.11.dev0"}
{"input": ["cuda -keys=cuda,gpu -arch=sm_89 -max_num_threads=1024 -thread_warp_size=32", "conv2d_nchw.cuda", [["TENSOR", [1, 64, 55, 55], "float32"], ["TENSOR", [16, 64, 1, 1], "float32"], [1, 1], [0, 0, 0, 0], [1, 1], "float32"], {}], "config": {"index": 275860, "code_hash": null, "entity": [["tile_f", "sp", [-1, 1, 1, 4]], ["tile_y", "sp", [-1, 1, 1, 5]], ["tile_x", "sp", [-1, 1, 1, 11]], ["tile_rc", "sp", [-1, 4]], ["tile_ry", "sp", [-1, 1]], ["tile_rx", "sp", [-1, 1]], ["auto_unroll_max_step", "ot", 512], ["unroll_explicit", "ot", 1]]}, "result": [[2.6929007130907924e-05], 0, 4.195104122161865, 1688498371.0471044], "version": 0.2, "tvm_version": "0.11.dev0"}
{"input": ["cuda -keys=cuda,gpu -arch=sm_89 -max_num_threads=1024 -thread_warp_size=32", "conv2d_nchw.cuda", [["TENSOR", [1, 64, 55, 55], "float32"], ["TENSOR", [16, 64, 1, 1], "float32"], [1, 1], [0, 0, 0, 0], [1, 1], "float32"], {}], "config": {"index": 30102, "code_hash": null, "entity": [["tile_f", "sp", [-1, 4, 1, 1]], ["tile_y", "sp", [-1, 1, 1, 11]], ["tile_x", "sp", [-1, 11, 5, 1]], ["tile_rc", "sp", [-1, 8]], ["tile_ry", "sp", [-1, 1]], ["tile_rx", "sp", [-1, 1]], ["auto_unroll_max_step", "ot", 0], ["unroll_explicit", "ot", 0]]}, "result": [[0.0006182875342518178], 0, 3.677489757537842, 1688498374.023138], "version": 0.2, "tvm_version": "0.11.dev0"}
{"input": ["cuda -keys=cuda,gpu -arch=sm_89 -max_num_threads=1024 -thread_warp_size=32", "conv2d_nchw.cuda", [["TENSOR", [1, 64, 55, 55], "float32"], ["TENSOR", [16, 64, 1, 1], "float32"], [1, 1], [0, 0, 0, 0], [1, 1], "float32"], {}], "config": {"index": 259988, "code_hash": null, "entity": [["tile_f", "sp", [-1, 8, 2, 1]], ["tile_y", "sp", [-1, 1, 5, 1]], ["tile_x", "sp", [-1, 1, 1, 1]], ["tile_rc", "sp", [-1, 2]], ["tile_ry", "sp", [-1, 1]], ["tile_rx", "sp", [-1, 1]], ["auto_unroll_max_step", "ot", 512], ["unroll_explicit", "ot", 1]]}, "result": [[7.433707086015585e-06], 0, 3.0622940063476562, 1688498376.802521], "version": 0.2, "tvm_version": "0.11.dev0"}
{"input": ["cuda -keys=cuda,gpu -arch=sm_89 -max_num_threads=1024 -thread_warp_size=32", "conv2d_nchw.cuda", [["TENSOR", [1, 64, 55, 55], "float32"], ["TENSOR", [16, 64, 1, 1], "float32"], [1, 1], [0, 0, 0, 0], [1, 1], "float32"], {}], "config": {"index": 150677, "code_hash": null, "entity": [["tile_f", "sp", [-1, 4, 1, 1]], ["tile_y", "sp", [-1, 5, 1, 1]], ["tile_x", "sp", [-1, 5, 1, 11]], ["tile_rc", "sp", [-1, 4]], ["tile_ry", "sp", [-1, 1]], ["tile_rx", "sp", [-1, 1]], ["auto_unroll_max_step", "ot", 1500], ["unroll_explicit", "ot", 0]]}, "result": [[0.0011302232606232295], 0, 7.823357820510864, 1688498379.7009528], "version": 0.2, "tvm_version": "0.11.dev0"}
{"input": ["cuda -keys=cuda,gpu -arch=sm_89 -max_num_threads=1024 -thread_warp_size=32", "conv2d_nchw.cuda", [["TENSOR", [1, 64, 55, 55], "float32"], ["TENSOR", [16, 64, 1, 1], "float32"], [1, 1], [0, 0, 0, 0], [1, 1], "float32"], {}], "config": {"index": 334326, "code_hash": null, "entity": [["tile_f", "sp", [-1, 2, 2, 1]], ["tile_y", "sp", [-1, 1, 1, 1]], ["tile_x", "sp", [-1, 11, 5, 1]], ["tile_rc", "sp", [-1, 4]], ["tile_ry", "sp", [-1, 1]], ["tile_rx", "sp", [-1, 1]], ["auto_unroll_max_step", "ot", 1500], ["unroll_explicit", "ot", 1]]}, "result": [[9.564845233491102e-06], 0, 3.380577564239502, 1688498382.5825262], "version": 0.2, "tvm_version": "0.11.dev0"}
{"input": ["cuda -keys=cuda,gpu -arch=sm_89 -max_num_threads=1024 -thread_warp_size=32", "conv2d_nchw.cuda", [["TENSOR", [1, 64, 55, 55], "float32"], ["TENSOR", [16, 64, 1, 1], "float32"], [1, 1], [0, 0, 0, 0], [1, 1], "float32"], {}], "config": {"index": 163061, "code_hash": null, "entity": [["tile_f", "sp", [-1, 1, 1, 8]], ["tile_y", "sp", [-1, 11, 1, 1]], ["tile_x", "sp", [-1, 55, 1, 1]], ["tile_rc", "sp", [-1, 16]], ["tile_ry", "sp", [-1, 1]], ["tile_rx", "sp", [-1, 1]], ["auto_unroll_max_step", "ot", 1500], ["unroll_explicit", "ot", 0]]}, "result": [[0.03646519032142857], 0, 7.449803590774536, 1688498384.328542], "version": 0.2, "tvm_version": "0.11.dev0"}
{"input": ["cuda -keys=cuda,gpu -arch=sm_89 -max_num_threads=1024 -thread_warp_size=32", "conv2d_nchw.cuda", [["TENSOR", [1, 64, 55, 55], "float32"], ["TENSOR", [16, 64, 1, 1], "float32"], [1, 1], [0, 0, 0, 0], [1, 1], "float32"], {}], "config": {"index": 231377, "code_hash": null, "entity": [["tile_f", "sp", [-1, 4, 1, 4]], ["tile_y", "sp", [-1, 11, 1, 1]], ["tile_x", "sp", [-1, 5, 1, 11]], ["tile_rc", "sp", [-1, 16]], ["tile_ry", "sp", [-1, 1]], ["tile_rx", "sp", [-1, 1]], ["auto_unroll_max_step", "ot", 0], ["unroll_explicit", "ot", 1]]}, "result": [[0.00723764133632287], 0, 6.869408369064331, 1688498387.3562746], "version": 0.2, "tvm_version": "0.11.dev0"}
{"input": ["cuda -keys=cuda,gpu -arch=sm_89 -max_num_threads=1024 -thread_warp_size=32", "conv2d_nchw.cuda", [["TENSOR", [1, 64, 55, 55], "float32"], ["TENSOR", [16, 64, 1, 1], "float32"], [1, 1], [0, 0, 0, 0], [1, 1], "float32"], {}], "config": {"index": 153456, "code_hash": null, "entity": [["tile_f", "sp", [-1, 2, 1, 2]], ["tile_y", "sp", [-1, 1, 1, 1]], ["tile_x", "sp", [-1, 11, 1, 1]], ["tile_rc", "sp", [-1, 8]], ["tile_ry", "sp", [-1, 1]], ["tile_rx", "sp", [-1, 1]], ["auto_unroll_max_step", "ot", 1500], ["unroll_explicit", "ot", 0]]}, "result": [[1.4062354314574833e-05], 0, 3.378880262374878, 1688498390.2705097], "version": 0.2, "tvm_version": "0.11.dev0"}
{"input": ["cuda -keys=cuda,gpu -arch=sm_89 -max_num_threads=1024 -thread_warp_size=32", "conv2d_nchw.cuda", [["TENSOR", [1, 64, 55, 55], "float32"], ["TENSOR", [16, 64, 1, 1], "float32"], [1, 1], [0, 0, 0, 0], [1, 1], "float32"], {}], "config": {"index": 275155, "code_hash": null, "entity": [["tile_f", "sp", [-1, 2, 2, 2]], ["tile_y", "sp", [-1, 11, 5, 1]], ["tile_x", "sp", [-1, 1, 11, 5]], ["tile_rc", "sp", [-1, 4]], ["tile_ry", "sp", [-1, 1]], ["tile_rx", "sp", [-1, 1]], ["auto_unroll_max_step", "ot", 512], ["unroll_explicit", "ot", 1]]}, "result": [[6.234226042192782e-05], 0, 4.180060625076294, 1688498393.2306826], "version": 0.2, "tvm_version": "0.11.dev0"}
{"input": ["cuda -keys=cuda,gpu -arch=sm_89 -max_num_threads=1024 -thread_warp_size=32", "conv2d_nchw.cuda", [["TENSOR", [1, 64, 55, 55], "float32"], ["TENSOR", [16, 64, 1, 1], "float32"], [1, 1], [0, 0, 0, 0], [1, 1], "float32"], {}], "config": {"index": 163636, "code_hash": null, "entity": [["tile_f", "sp", [-1, 4, 4, 1]], ["tile_y", "sp", [-1, 55, 1, 1]], ["tile_x", "sp", [-1, 1, 5, 1]], ["tile_rc", "sp", [-1, 16]], ["tile_ry", "sp", [-1, 1]], ["tile_rx", "sp", [-1, 1]], ["auto_unroll_max_step", "ot", 1500], ["unroll_explicit", "ot", 0]]}, "result": [[2.1741631594056295e-05], 0, 3.8397560119628906, 1688498396.1239202], "version": 0.2, "tvm_version": "0.11.dev0"}
{"input": ["cuda -keys=cuda,gpu -arch=sm_89 -max_num_threads=1024 -thread_warp_size=32", "conv2d_nchw.cuda", [["TENSOR", [1, 16, 55, 55], "float32"], ["TENSOR", [64, 16, 1, 1], "float32"], [1, 1], [0, 0, 0, 0], [1, 1], "float32"], {}], "config": {"index": 362892, "code_hash": null, "entity": [["tile_f", "sp", [-1, 32, 2, 1]], ["tile_y", "sp", [-1, 1, 1, 1]], ["tile_x", "sp", [-1, 1, 5, 11]], ["tile_rc", "sp", [-1, 2]], ["tile_ry", "sp", [-1, 1]], ["tile_rx", "sp", [-1, 1]], ["auto_unroll_max_step", "ot", 0], ["unroll_explicit", "ot", 1]]}, "result": [[4.123855236290273e-05], 0, 2.965224266052246, 1688498409.2654734], "version": 0.2, "tvm_version": "0.11.dev0"}
{"input": ["cuda -keys=cuda,gpu -arch=sm_89 -max_num_threads=1024 -thread_warp_size=32", "conv2d_nchw.cuda", [["TENSOR", [1, 16, 55, 55], "float32"], ["TENSOR", [64, 16, 1, 1], "float32"], [1, 1], [0, 0, 0, 0], [1, 1], "float32"], {}], "config": {"index": 288035, "code_hash": null, "entity": [["tile_f", "sp", [-1, 1, 1, 64]], ["tile_y", "sp", [-1, 1, 5, 1]], ["tile_x", "sp", [-1, 1, 11, 1]], ["tile_rc", "sp", [-1, 8]], ["tile_ry", "sp", [-1, 1]], ["tile_rx", "sp", [-1, 1]], ["auto_unroll_max_step", "ot", 1500], ["unroll_explicit", "ot", 0]]}, "result": [[3.860302421962031e-06], 0, 3.6972222328186035, 1688498411.9944894], "version": 0.2, "tvm_version": "0.11.dev0"}
{"input": ["cuda -keys=cuda,gpu -arch=sm_89 -max_num_threads=1024 -thread_warp_size=32", "conv2d_nchw.cuda", [["TENSOR", [1, 16, 55, 55], "float32"], ["TENSOR", [64, 16, 1, 1], "float32"], [1, 1], [0, 0, 0, 0], [1, 1], "float32"], {}], "config": {"index": 472576, "code_hash": null, "entity": [["tile_f", "sp", [-1, 4, 1, 16]], ["tile_y", "sp", [-1, 1, 1, 5]], ["tile_x", "sp", [-1, 1, 1, 55]], ["tile_rc", "sp", [-1, 2]], ["tile_ry", "sp", [-1, 1]], ["tile_rx", "sp", [-1, 1]], ["auto_unroll_max_step", "ot", 512], ["unroll_explicit", "ot", 1]]}, "result": [[0.0030865890076628355], 0, 7.421973466873169, 1688498414.9670768], "version": 0.2, "tvm_version": "0.11.dev0"}
{"input": ["cuda -keys=cuda,gpu -arch=sm_89 -max_num_threads=1024 -thread_warp_size=32", "conv2d_nchw.cuda", [["TENSOR", [1, 16, 55, 55], "float32"], ["TENSOR", [64, 16, 1, 1], "float32"], [1, 1], [0, 0, 0, 0], [1, 1], "float32"], {}], "config": {"index": 13252, "code_hash": null, "entity": [["tile_f", "sp", [-1, 1, 1, 8]], ["tile_y", "sp", [-1, 5, 1, 11]], ["tile_x", "sp", [-1, 1, 1, 5]], ["tile_rc", "sp", [-1, 1]], ["tile_ry", "sp", [-1, 1]], ["tile_rx", "sp", [-1, 1]], ["auto_unroll_max_step", "ot", 0], ["unroll_explicit", "ot", 0]]}, "result": [[0.0007888720309072782], 0, 4.8970255851745605, 1688498417.9659653], "version": 0.2, "tvm_version": "0.11.dev0"}
{"input": ["cuda -keys=cuda,gpu -arch=sm_89 -max_num_threads=1024 -thread_warp_size=32", "conv2d_nchw.cuda", [["TENSOR", [1, 16, 55, 55], "float32"], ["TENSOR", [64, 16, 1, 1], "float32"], [1, 1], [0, 0, 0, 0], [1, 1], "float32"], {}], "config": {"index": 92074, "code_hash": null, "entity": [["tile_f", "sp", [-1, 8, 2, 1]], ["tile_y", "sp", [-1, 1, 55, 1]], ["tile_x", "sp", [-1, 1, 5, 1]], ["tile_rc", "sp", [-1, 16]], ["tile_ry", "sp", [-1, 1]], ["tile_rx", "sp", [-1, 1]], ["auto_unroll_max_step", "ot", 0], ["unroll_explicit", "ot", 0]]}, "result": [[4.884579672752643e-06], 0, 2.9677460193634033, 1688498420.6938207], "version": 0.2, "tvm_version": "0.11.dev0"}
{"input": ["cuda -keys=cuda,gpu -arch=sm_89 -max_num_threads=1024 -thread_warp_size=32", "conv2d_nchw.cuda", [["TENSOR", [1, 16, 55, 55], "float32"], ["TENSOR", [64, 16, 1, 1], "float32"], [1, 1], [0, 0, 0, 0], [1, 1], "float32"], {}], "config": {"index": 71636, "code_hash": null, "entity": [["tile_f", "sp", [-1, 1, 2, 8]], ["tile_y", "sp", [-1, 1, 5, 1]], ["tile_x", "sp", [-1, 11, 5, 1]], ["tile_rc", "sp", [-1, 8]], ["tile_ry", "sp", [-1, 1]], ["tile_rx", "sp", [-1, 1]], ["auto_unroll_max_step", "ot", 0], ["unroll_explicit", "ot", 0]]}, "result": [[8.317475906366593e-06], 0, 3.147853374481201, 1688498423.4830256], "version": 0.2, "tvm_version": "0.11.dev0"}
{"input": ["cuda -keys=cuda,gpu -arch=sm_89 -max_num_threads=1024 -thread_warp_size=32", "conv2d_nchw.cuda", [["TENSOR", [1, 16, 55, 55], "float32"], ["TENSOR", [64, 16, 1, 1], "float32"], [1, 1], [0, 0, 0, 0], [1, 1], "float32"], {}], "config": {"index": 544129, "code_hash": null, "entity": [["tile_f", "sp", [-1, 1, 8, 4]], ["tile_y", "sp", [-1, 5, 1, 11]], ["tile_x", "sp", [-1, 1, 5, 1]], ["tile_rc", "sp", [-1, 1]], ["tile_ry", "sp", [-1, 1]], ["tile_rx", "sp", [-1, 1]], ["auto_unroll_max_step", "ot", 1500], ["unroll_explicit", "ot", 1]]}, "result": [[1.0282785392245266e-05], 0, 3.7068867683410645, 1688498426.37159], "version": 0.2, "tvm_version": "0.11.dev0"}
{"input": ["cuda -keys=cuda,gpu -arch=sm_89 -max_num_threads=1024 -thread_warp_size=32", "conv2d_nchw.cuda", [["TENSOR", [1, 16, 55, 55], "float32"], ["TENSOR", [64, 16, 1, 1], "float32"], [1, 1], [0, 0, 0, 0], [1, 1], "float32"], {}], "config": {"index": 245614, "code_hash": null, "entity": [["tile_f", "sp", [-1, 1, 2, 32]], ["tile_y", "sp", [-1, 1, 11, 5]], ["tile_x", "sp", [-1, 1, 11, 1]], ["tile_rc", "sp", [-1, 2]], ["tile_ry", "sp", [-1, 1]], ["tile_rx", "sp", [-1, 1]], ["auto_unroll_max_step", "ot", 1500], ["unroll_explicit", "ot", 0]]}, "result": [[1.393502005085812e-05], 0, 3.2728052139282227, 1688498429.2286787], "version": 0.2, "tvm_version": "0.11.dev0"}
{"input": ["cuda -keys=cuda,gpu -arch=sm_89 -max_num_threads=1024 -thread_warp_size=32", "conv2d_nchw.cuda", [["TENSOR", [1, 16, 55, 55], "float32"], ["TENSOR", [64, 16, 1, 1], "float32"], [1, 1], [0, 0, 0, 0], [1, 1], "float32"], {}], "config": {"index": 560426, "code_hash": null, "entity": [["tile_f", "sp", [-1, 2, 8, 4]], ["tile_y", "sp", [-1, 1, 1, 55]], ["tile_x", "sp", [-1, 1, 1, 1]], ["tile_rc", "sp", [-1, 2]], ["tile_ry", "sp", [-1, 1]], ["tile_rx", "sp", [-1, 1]], ["auto_unroll_max_step", "ot", 1500], ["unroll_explicit", "ot", 1]]}, "result": [[2.9705929376832292e-05], 0, 5.020293235778809, 1688498432.105836], "version": 0.2, "tvm_version": "0.11.dev0"}
{"input": ["cuda -keys=cuda,gpu -arch=sm_89 -max_num_threads=1024 -thread_warp_size=32", "conv2d_nchw.cuda", [["TENSOR", [1, 16, 55, 55], "float32"], ["TENSOR", [64, 16, 1, 1], "float32"], [1, 1], [0, 0, 0, 0], [1, 1], "float32"], {}], "config": {"index": 137554, "code_hash": null, "entity": [["tile_f", "sp", [-1, 1, 16, 2]], ["tile_y", "sp", [-1, 11, 5, 1]], ["tile_x", "sp", [-1, 1, 11, 1]], ["tile_rc", "sp", [-1, 2]], ["tile_ry", "sp", [-1, 1]], ["tile_rx", "sp", [-1, 1]], ["auto_unroll_max_step", "ot", 512], ["unroll_explicit", "ot", 0]]}, "result": [[1.0668290668744531e-05], 0, 3.303649425506592, 1688498434.9850543], "version": 0.2, "tvm_version": "0.11.dev0"}
{"input": ["cuda -keys=cuda,gpu -arch=sm_89 -max_num_threads=1024 -thread_warp_size=32", "conv2d_nchw.cuda", [["TENSOR", [1, 16, 55, 55], "float32"], ["TENSOR", [64, 16, 1, 1], "float32"], [1, 1], [0, 0, 0, 0], [1, 1], "float32"], {}], "config": {"index": 147476, "code_hash": null, "entity": [["tile_f", "sp", [-1, 4, 2, 4]], ["tile_y", "sp", [-1, 1, 11, 5]], ["tile_x", "sp", [-1, 5, 1, 11]], ["tile_rc", "sp", [-1, 2]], ["tile_ry", "sp", [-1, 1]], ["tile_rx", "sp", [-1, 1]], ["auto_unroll_max_step", "ot", 512], ["unroll_explicit", "ot", 0]]}, "result": [[0.0005274009880873594], 0, 4.721071004867554, 1688498437.8891308], "version": 0.2, "tvm_version": "0.11.dev0"}
{"input": ["cuda -keys=cuda,gpu -arch=sm_89 -max_num_threads=1024 -thread_warp_size=32", "conv2d_nchw.cuda", [["TENSOR", [1, 16, 55, 55], "float32"], ["TENSOR", [64, 16, 1, 1], "float32"], [1, 1], [0, 0, 0, 0], [1, 1], "float32"], {}], "config": {"index": 340638, "code_hash": null, "entity": [["tile_f", "sp", [-1, 1, 8, 1]], ["tile_y", "sp", [-1, 5, 11, 1]], ["tile_x", "sp", [-1, 5, 1, 11]], ["tile_rc", "sp", [-1, 1]], ["tile_ry", "sp", [-1, 1]], ["tile_rx", "sp", [-1, 1]], ["auto_unroll_max_step", "ot", 0], ["unroll_explicit", "ot", 1]]}, "result": [[0.0001083789321931183], 0, 3.5385870933532715, 1688498440.8154178], "version": 0.2, "tvm_version": "0.11.dev0"}
{"input": ["cuda -keys=cuda,gpu -arch=sm_89 -max_num_threads=1024 -thread_warp_size=32", "conv2d_nchw.cuda", [["TENSOR", [1, 16, 55, 55], "float32"], ["TENSOR", [64, 16, 1, 1], "float32"], [1, 1], [0, 0, 0, 0], [1, 1], "float32"], {}], "config": {"index": 475093, "code_hash": null, "entity": [["tile_f", "sp", [-1, 1, 8, 8]], ["tile_y", "sp", [-1, 5, 11, 1]], ["tile_x", "sp", [-1, 5, 1, 1]], ["tile_rc", "sp", [-1, 4]], ["tile_ry", "sp", [-1, 1]], ["tile_rx", "sp", [-1, 1]], ["auto_unroll_max_step", "ot", 512], ["unroll_explicit", "ot", 1]]}, "result": [[2.0598913992782793e-05], 0, 3.769571542739868, 1688498443.7465386], "version": 0.2, "tvm_version": "0.11.dev0"}
{"input": ["cuda -keys=cuda,gpu -arch=sm_89 -max_num_threads=1024 -thread_warp_size=32", "conv2d_nchw.cuda", [["TENSOR", [1, 16, 55, 55], "float32"], ["TENSOR", [64, 16, 1, 1], "float32"], [1, 1], [0, 0, 0, 0], [1, 1], "float32"], {}], "config": {"index": 507827, "code_hash": null, "entity": [["tile_f", "sp", [-1, 2, 16, 2]], ["tile_y", "sp", [-1, 5, 1, 11]], ["tile_x", "sp", [-1, 1, 1, 5]], ["tile_rc", "sp", [-1, 8]], ["tile_ry", "sp", [-1, 1]], ["tile_rx", "sp", [-1, 1]], ["auto_unroll_max_step", "ot", 512], ["unroll_explicit", "ot", 1]]}, "result": [[0.00017216676380728556], 0, 5.084853410720825, 1688498446.6678448], "version": 0.2, "tvm_version": "0.11.dev0"}
{"input": ["cuda -keys=cuda,gpu -arch=sm_89 -max_num_threads=1024 -thread_warp_size=32", "conv2d_nchw.cuda", [["TENSOR", [1, 16, 55, 55], "float32"], ["TENSOR", [64, 16, 1, 1], "float32"], [1, 1], [0, 0, 0, 0], [1, 1], "float32"], {}], "config": {"index": 382726, "code_hash": null, "entity": [["tile_f", "sp", [-1, 1, 16, 1]], ["tile_y", "sp", [-1, 1, 1, 11]], ["tile_x", "sp", [-1, 1, 1, 11]], ["tile_rc", "sp", [-1, 4]], ["tile_ry", "sp", [-1, 1]], ["tile_rx", "sp", [-1, 1]], ["auto_unroll_max_step", "ot", 0], ["unroll_explicit", "ot", 1]]}, "result": [[1.4976263245331738e-05], 0, 3.297346830368042, 1688498449.532872], "version": 0.2, "tvm_version": "0.11.dev0"}
{"input": ["cuda -keys=cuda,gpu -arch=sm_89 -max_num_threads=1024 -thread_warp_size=32", "conv2d_nchw.cuda", [["TENSOR", [1, 16, 55, 55], "float32"], ["TENSOR", [64, 16, 1, 1], "float32"], [1, 1], [0, 0, 0, 0], [1, 1], "float32"], {}], "config": {"index": 263472, "code_hash": null, "entity": [["tile_f", "sp", [-1, 1, 32, 2]], ["tile_y", "sp", [-1, 1, 1, 1]], ["tile_x", "sp", [-1, 1, 5, 1]], ["tile_rc", "sp", [-1, 4]], ["tile_ry", "sp", [-1, 1]], ["tile_rx", "sp", [-1, 1]], ["auto_unroll_max_step", "ot", 1500], ["unroll_explicit", "ot", 0]]}, "result": [[3.879217358021148e-06], 0, 2.9907279014587402, 1688498452.247678], "version": 0.2, "tvm_version": "0.11.dev0"}
{"input": ["cuda -keys=cuda,gpu -arch=sm_89 -max_num_threads=1024 -thread_warp_size=32", "conv2d_nchw.cuda", [["TENSOR", [1, 16, 55, 55], "float32"], ["TENSOR", [64, 16, 1, 1], "float32"], [1, 1], [0, 0, 0, 0], [1, 1], "float32"], {}], "config": {"index": 117128, "code_hash": null, "entity": [["tile_f", "sp", [-1, 16, 1, 2]], ["tile_y", "sp", [-1, 11, 1, 1]], ["tile_x", "sp", [-1, 5, 11, 1]], ["tile_rc", "sp", [-1, 1]], ["tile_ry", "sp", [-1, 1]], ["tile_rx", "sp", [-1, 1]], ["auto_unroll_max_step", "ot", 512], ["unroll_explicit", "ot", 0]]}, "result": [[0.0032936259522821578], 0, 10.356953382492065, 1688498455.1734018], "version": 0.2, "tvm_version": "0.11.dev0"}
{"input": ["cuda -keys=cuda,gpu -arch=sm_89 -max_num_threads=1024 -thread_warp_size=32", "conv2d_nchw.cuda", [["TENSOR", [1, 16, 55, 55], "float32"], ["TENSOR", [64, 16, 1, 1], "float32"], [1, 1], [0, 0, 0, 0], [1, 1], "float32"], {}], "config": {"index": 108598, "code_hash": null, "entity": [["tile_f", "sp", [-1, 4, 2, 8]], ["tile_y", "sp", [-1, 1, 1, 11]], ["tile_x", "sp", [-1, 1, 1, 1]], ["tile_rc", "sp", [-1, 1]], ["tile_ry", "sp", [-1, 1]], ["tile_rx", "sp", [-1, 1]], ["auto_unroll_max_step", "ot", 512], ["unroll_explicit", "ot", 0]]}, "result": [[2.5526895681255427e-05], 0, 3.435798406600952, 1688498458.070467], "version": 0.2, "tvm_version": "0.11.dev0"}
{"input": ["cuda -keys=cuda,gpu -arch=sm_89 -max_num_threads=1024 -thread_warp_size=32", "conv2d_nchw.cuda", [["TENSOR", [1, 16, 55, 55], "float32"], ["TENSOR", [64, 16, 1, 1], "float32"], [1, 1], [0, 0, 0, 0], [1, 1], "float32"], {}], "config": {"index": 372465, "code_hash": null, "entity": [["tile_f", "sp", [-1, 4, 2, 1]], ["tile_y", "sp", [-1, 11, 1, 1]], ["tile_x", "sp", [-1, 11, 5, 1]], ["tile_rc", "sp", [-1, 4]], ["tile_ry", "sp", [-1, 1]], ["tile_rx", "sp", [-1, 1]], ["auto_unroll_max_step", "ot", 0], ["unroll_explicit", "ot", 1]]}, "result": [[0.00014743663707498836], 0, 4.972824573516846, 1688498460.996772], "version": 0.2, "tvm_version": "0.11.dev0"}
{"input": ["cuda -keys=cuda,gpu -arch=sm_89 -max_num_threads=1024 -thread_warp_size=32", "conv2d_nchw.cuda", [["TENSOR", [1, 16, 55, 55], "float32"], ["TENSOR", [64, 16, 1, 1], "float32"], [1, 1], [0, 0, 0, 0], [1, 1], "float32"], {}], "config": {"index": 131803, "code_hash": null, "entity": [["tile_f", "sp", [-1, 1, 2, 1]], ["tile_y", "sp", [-1, 5, 1, 1]], ["tile_x", "sp", [-1, 11, 1, 1]], ["tile_rc", "sp", [-1, 2]], ["tile_ry", "sp", [-1, 1]], ["tile_rx", "sp", [-1, 1]], ["auto_unroll_max_step", "ot", 512], ["unroll_explicit", "ot", 0]]}, "result": [[1.8640924212621474e-05], 0, 3.290131092071533, 1688498463.887678], "version": 0.2, "tvm_version": "0.11.dev0"}
{"input": ["cuda -keys=cuda,gpu -arch=sm_89 -max_num_threads=1024 -thread_warp_size=32", "conv2d_nchw.cuda", [["TENSOR", [1, 16, 55, 55], "float32"], ["TENSOR", [64, 16, 1, 1], "float32"], [1, 1], [0, 0, 0, 0], [1, 1], "float32"], {}], "config": {"index": 533581, "code_hash": null, "entity": [["tile_f", "sp", [-1, 1, 4, 1]], ["tile_y", "sp", [-1, 1, 1, 1]], ["tile_x", "sp", [-1, 5, 1, 11]], ["tile_rc", "sp", [-1, 16]], ["tile_ry", "sp", [-1, 1]], ["tile_rx", "sp", [-1, 1]], ["auto_unroll_max_step", "ot", 512], ["unroll_explicit", "ot", 1]]}, "result": [[5.7655163010118405e-06], 0, 3.7458600997924805, 1688498466.6170878], "version": 0.2, "tvm_version": "0.11.dev0"}
{"input": ["cuda -keys=cuda,gpu -arch=sm_89 -max_num_threads=1024 -thread_warp_size=32", "conv2d_nchw.cuda", [["TENSOR", [1, 16, 55, 55], "float32"], ["TENSOR", [64, 16, 1, 1], "float32"], [1, 1], [0, 0, 0, 0], [1, 1], "float32"], {}], "config": {"index": 597971, "code_hash": null, "entity": [["tile_f", "sp", [-1, 2, 4, 4]], ["tile_y", "sp", [-1, 1, 5, 11]], ["tile_x", "sp", [-1, 1, 1, 11]], ["tile_rc", "sp", [-1, 4]], ["tile_ry", "sp", [-1, 1]], ["tile_rx", "sp", [-1, 1]], ["auto_unroll_max_step", "ot", 1500], ["unroll_explicit", "ot", 1]]}, "result": [[0.00020619394628422423], 0, 10.090957403182983, 1688498469.5401633], "version": 0.2, "tvm_version": "0.11.dev0"}
{"input": ["cuda -keys=cuda,gpu -arch=sm_89 -max_num_threads=1024 -thread_warp_size=32", "conv2d_nchw.cuda", [["TENSOR", [1, 16, 55, 55], "float32"], ["TENSOR", [64, 16, 1, 1], "float32"], [1, 1], [0, 0, 0, 0], [1, 1], "float32"], {}], "config": {"index": 255630, "code_hash": null, "entity": [["tile_f", "sp", [-1, 1, 8, 1]], ["tile_y", "sp", [-1, 55, 1, 1]], ["tile_x", "sp", [-1, 1, 5, 11]], ["tile_rc", "sp", [-1, 2]], ["tile_ry", "sp", [-1, 1]], ["tile_rx", "sp", [-1, 1]], ["auto_unroll_max_step", "ot", 1500], ["unroll_explicit", "ot", 0]]}, "result": [[0.00017814246443190618], 0, 7.310332775115967, 1688498472.4723053], "version": 0.2, "tvm_version": "0.11.dev0"}
{"input": ["cuda -keys=cuda,gpu -arch=sm_89 -max_num_threads=1024 -thread_warp_size=32", "conv2d_nchw.cuda", [["TENSOR", [1, 16, 55, 55], "float32"], ["TENSOR", [64, 16, 1, 1], "float32"], [1, 1], [0, 0, 0, 0], [1, 1], "float32"], {}], "config": {"index": 397885, "code_hash": null, "entity": [["tile_f", "sp", [-1, 1, 8, 4]], ["tile_y", "sp", [-1, 1, 1, 1]], ["tile_x", "sp", [-1, 1, 55, 1]], ["tile_rc", "sp", [-1, 8]], ["tile_ry", "sp", [-1, 1]], ["tile_rx", "sp", [-1, 1]], ["auto_unroll_max_step", "ot", 0], ["unroll_explicit", "ot", 1]]}, "result": [[2.7834179509508093e-06], 0, 2.8010470867156982, 1688498475.0127778], "version": 0.2, "tvm_version": "0.11.dev0"}
{"input": ["cuda -keys=cuda,gpu -arch=sm_89 -max_num_threads=1024 -thread_warp_size=32", "conv2d_nchw.cuda", [["TENSOR", [1, 16, 55, 55], "float32"], ["TENSOR", [64, 16, 1, 1], "float32"], [1, 1], [0, 0, 0, 0], [1, 1], "float32"], {}], "config": {"index": 153028, "code_hash": null, "entity": [["tile_f", "sp", [-1, 1, 1, 8]], ["tile_y", "sp", [-1, 5, 1, 11]], ["tile_x", "sp", [-1, 5, 1, 1]], ["tile_rc", "sp", [-1, 4]], ["tile_ry", "sp", [-1, 1]], ["tile_rx", "sp", [-1, 1]], ["auto_unroll_max_step", "ot", 512], ["unroll_explicit", "ot", 0]]}, "result": [[0.003805222817966903], 0, 4.942160606384277, 1688498478.0259113], "version": 0.2, "tvm_version": "0.11.dev0"}
{"input": ["cuda -keys=cuda,gpu -arch=sm_89 -max_num_threads=1024 -thread_warp_size=32", "conv2d_nchw.cuda", [["TENSOR", [1, 16, 55, 55], "float32"], ["TENSOR", [64, 16, 1, 1], "float32"], [1, 1], [0, 0, 0, 0], [1, 1], "float32"], {}], "config": {"index": 268483, "code_hash": null, "entity": [["tile_f", "sp", [-1, 2, 8, 1]], ["tile_y", "sp", [-1, 1, 1, 11]], ["tile_x", "sp", [-1, 5, 11, 1]], ["tile_rc", "sp", [-1, 4]], ["tile_ry", "sp", [-1, 1]], ["tile_rx", "sp", [-1, 1]], ["auto_unroll_max_step", "ot", 1500], ["unroll_explicit", "ot", 0]]}, "result": [[9.349152817568224e-06], 0, 3.398221015930176, 1688498480.8383322], "version": 0.2, "tvm_version": "0.11.dev0"}
{"input": ["cuda -keys=cuda,gpu -arch=sm_89 -max_num_threads=1024 -thread_warp_size=32", "conv2d_nchw.cuda", [["TENSOR", [1, 16, 55, 55], "float32"], ["TENSOR", [64, 16, 1, 1], "float32"], [1, 1], [0, 0, 0, 0], [1, 1], "float32"], {}], "config": {"index": 442267, "code_hash": null, "entity": [["tile_f", "sp", [-1, 1, 2, 1]], ["tile_y", "sp", [-1, 5, 1, 1]], ["tile_x", "sp", [-1, 1, 1, 5]], ["tile_rc", "sp", [-1, 1]], ["tile_ry", "sp", [-1, 1]], ["tile_rx", "sp", [-1, 1]], ["auto_unroll_max_step", "ot", 512], ["unroll_explicit", "ot", 1]]}, "result": [[1.7226642880740004e-05], 0, 3.1790225505828857, 1688498483.687547], "version": 0.2, "tvm_version": "0.11.dev0"}
{"input": ["cuda -keys=cuda,gpu -arch=sm_89 -max_num_threads=1024 -thread_warp_size=32", "conv2d_nchw.cuda", [["TENSOR", [1, 16, 55, 55], "float32"], ["TENSOR", [64, 16, 1, 1], "float32"], [1, 1], [0, 0, 0, 0], [1, 1], "float32"], {}], "config": {"index": 498600, "code_hash": null, "entity": [["tile_f", "sp", [-1, 4, 4, 4]], ["tile_y", "sp", [-1, 1, 1, 55]], ["tile_x", "sp", [-1, 11, 1, 1]], ["tile_rc", "sp", [-1, 8]], ["tile_ry", "sp", [-1, 1]], ["tile_rx", "sp", [-1, 1]], ["auto_unroll_max_step", "ot", 512], ["unroll_explicit", "ot", 1]]}, "result": [[0.0012024844740796395], 0, 3.933156967163086, 1688498486.655059], "version": 0.2, "tvm_version": "0.11.dev0"}
{"input": ["cuda -keys=cuda,gpu -arch=sm_89 -max_num_threads=1024 -thread_warp_size=32", "conv2d_nchw.cuda", [["TENSOR", [1, 16, 55, 55], "float32"], ["TENSOR", [64, 16, 1, 1], "float32"], [1, 1], [0, 0, 0, 0], [1, 1], "float32"], {}], "config": {"index": 539545, "code_hash": null, "entity": [["tile_f", "sp", [-1, 1, 4, 1]], ["tile_y", "sp", [-1, 5, 11, 1]], ["tile_x", "sp", [-1, 5, 1, 1]], ["tile_rc", "sp", [-1, 1]], ["tile_ry", "sp", [-1, 1]], ["tile_rx", "sp", [-1, 1]], ["auto_unroll_max_step", "ot", 1500], ["unroll_explicit", "ot", 1]]}, "result": [[1.5878563323990976e-05], 0, 3.8553028106689453, 1688498489.5356858], "version": 0.2, "tvm_version": "0.11.dev0"}
{"input": ["cuda -keys=cuda,gpu -arch=sm_89 -max_num_threads=1024 -thread_warp_size=32", "conv2d_nchw.cuda", [["TENSOR", [1, 16, 55, 55], "float32"], ["TENSOR", [64, 16, 1, 1], "float32"], [1, 1], [0, 0, 0, 0], [1, 1], "float32"], {}], "config": {"index": 128478, "code_hash": null, "entity": [["tile_f", "sp", [-1, 8, 4, 2]], ["tile_y", "sp", [-1, 1, 1, 5]], ["tile_x", "sp", [-1, 1, 1, 55]], ["tile_rc", "sp", [-1, 1]], ["tile_ry", "sp", [-1, 1]], ["tile_rx", "sp", [-1, 1]], ["auto_unroll_max_step", "ot", 512], ["unroll_explicit", "ot", 0]]}, "result": [[0.0005037211942423283], 0, 6.719749689102173, 1688498492.458031], "version": 0.2, "tvm_version": "0.11.dev0"}
{"input": ["cuda -keys=cuda,gpu -arch=sm_89 -max_num_threads=1024 -thread_warp_size=32", "conv2d_nchw.cuda", [["TENSOR", [1, 16, 55, 55], "float32"], ["TENSOR", [64, 16, 1, 1], "float32"], [1, 1], [0, 0, 0, 0], [1, 1], "float32"], {}], "config": {"index": 394590, "code_hash": null, "entity": [["tile_f", "sp", [-1, 8, 4, 2]], ["tile_y", "sp", [-1, 1, 1, 5]], ["tile_x", "sp", [-1, 11, 5, 1]], ["tile_rc", "sp", [-1, 8]], ["tile_ry", "sp", [-1, 1]], ["tile_rx", "sp", [-1, 1]], ["auto_unroll_max_step", "ot", 0], ["unroll_explicit", "ot", 1]]}, "result": [[9.55818653625551e-05], 0, 4.740500450134277, 1688498495.386671], "version": 0.2, "tvm_version": "0.11.dev0"}
{"input": ["cuda -keys=cuda,gpu -arch=sm_89 -max_num_threads=1024 -thread_warp_size=32", "conv2d_nchw.cuda", [["TENSOR", [1, 16, 55, 55], "float32"], ["TENSOR", [64, 16, 1, 1], "float32"], [1, 1], [0, 0, 0, 0], [1, 1], "float32"], {}], "config": {"index": 229646, "code_hash": null, "entity": [["tile_f", "sp", [-1, 1, 1, 16]], ["tile_y", "sp", [-1, 5, 1, 11]], ["tile_x", "sp", [-1, 11, 1, 5]], ["tile_rc", "sp", [-1, 1]], ["tile_ry", "sp", [-1, 1]], ["tile_rx", "sp", [-1, 1]], ["auto_unroll_max_step", "ot", 1500], ["unroll_explicit", "ot", 0]]}, "result": [[0.008657000139784946], 0, 5.584510803222656, 1688498498.4391708], "version": 0.2, "tvm_version": "0.11.dev0"}
{"input": ["cuda -keys=cuda,gpu -arch=sm_89 -max_num_threads=1024 -thread_warp_size=32", "conv2d_nchw.cuda", [["TENSOR", [1, 16, 55, 55], "float32"], ["TENSOR", [64, 16, 1, 1], "float32"], [1, 1], [0, 0, 0, 0], [1, 1], "float32"], {}], "config": {"index": 246388, "code_hash": null, "entity": [["tile_f", "sp", [-1, 8, 4, 1]], ["tile_y", "sp", [-1, 11, 5, 1]], ["tile_x", "sp", [-1, 5, 11, 1]], ["tile_rc", "sp", [-1, 2]], ["tile_ry", "sp", [-1, 1]], ["tile_rx", "sp", [-1, 1]], ["auto_unroll_max_step", "ot", 1500], ["unroll_explicit", "ot", 0]]}, "result": [[9.148498310195722e-05], 0, 5.045528411865234, 1688498501.4646962], "version": 0.2, "tvm_version": "0.11.dev0"}
{"input": ["cuda -keys=cuda,gpu -arch=sm_89 -max_num_threads=1024 -thread_warp_size=32", "conv2d_nchw.cuda", [["TENSOR", [1, 16, 55, 55], "float32"], ["TENSOR", [64, 16, 1, 1], "float32"], [1, 1], [0, 0, 0, 0], [1, 1], "float32"], {}], "config": {"index": 41789, "code_hash": null, "entity": [["tile_f", "sp", [-1, 4, 4, 2]], ["tile_y", "sp", [-1, 5, 1, 1]], ["tile_x", "sp", [-1, 1, 1, 55]], ["tile_rc", "sp", [-1, 2]], ["tile_ry", "sp", [-1, 1]], ["tile_rx", "sp", [-1, 1]], ["auto_unroll_max_step", "ot", 0], ["unroll_explicit", "ot", 0]]}, "result": [[0.000448795692177351], 0, 3.3474481105804443, 1688498504.4288642], "version": 0.2, "tvm_version": "0.11.dev0"}
{"input": ["cuda -keys=cuda,gpu -arch=sm_89 -max_num_threads=1024 -thread_warp_size=32", "conv2d_nchw.cuda", [["TENSOR", [1, 16, 55, 55], "float32"], ["TENSOR", [64, 16, 1, 1], "float32"], [1, 1], [0, 0, 0, 0], [1, 1], "float32"], {}], "config": {"index": 122826, "code_hash": null, "entity": [["tile_f", "sp", [-1, 1, 8, 1]], ["tile_y", "sp", [-1, 1, 11, 1]], ["tile_x", "sp", [-1, 1, 11, 5]], ["tile_rc", "sp", [-1, 1]], ["tile_ry", "sp", [-1, 1]], ["tile_rx", "sp", [-1, 1]], ["auto_unroll_max_step", "ot", 512], ["unroll_explicit", "ot", 0]]}, "result": [[8.23302744560101e-06], 0, 3.1020779609680176, 1688498507.2228093], "version": 0.2, "tvm_version": "0.11.dev0"}
{"input": ["cuda -keys=cuda,gpu -arch=sm_89 -max_num_threads=1024 -thread_warp_size=32", "conv2d_nchw.cuda", [["TENSOR", [1, 16, 55, 55], "float32"], ["TENSOR", [64, 16, 1, 1], "float32"], [1, 1], [0, 0, 0, 0], [1, 1], "float32"], {}], "config": {"index": 118340, "code_hash": null, "entity": [["tile_f", "sp", [-1, 1, 2, 8]], ["tile_y", "sp", [-1, 1, 1, 1]], ["tile_x", "sp", [-1, 1, 55, 1]], ["tile_rc", "sp", [-1, 1]], ["tile_ry", "sp", [-1, 1]], ["tile_rx", "sp", [-1, 1]], ["auto_unroll_max_step", "ot", 512], ["unroll_explicit", "ot", 0]]}, "result": [[3.678225798612254e-06], 0, 2.9379465579986572, 1688498509.9022326], "version": 0.2, "tvm_version": "0.11.dev0"}
{"input": ["cuda -keys=cuda,gpu -arch=sm_89 -max_num_threads=1024 -thread_warp_size=32", "conv2d_nchw.cuda", [["TENSOR", [1, 16, 55, 55], "float32"], ["TENSOR", [64, 16, 3, 3], "float32"], [1, 1], [1, 1, 1, 1], [1, 1], "float32"], {}], "config": {"index": 515509, "code_hash": null, "entity": [["tile_f", "sp", [-1, 2, 1, 1]], ["tile_y", "sp", [-1, 1, 1, 5]], ["tile_x", "sp", [-1, 1, 1, 55]], ["tile_rc", "sp", [-1, 8]], ["tile_ry", "sp", [-1, 1]], ["tile_rx", "sp", [-1, 1]], ["auto_unroll_max_step", "ot", 512], ["unroll_explicit", "ot", 0]]}, "result": [[0.004993884945273632], 0, 2.195068359375, 1688498521.9765003], "version": 0.2, "tvm_version": "0.11.dev0"}
{"input": ["cuda -keys=cuda,gpu -arch=sm_89 -max_num_threads=1024 -thread_warp_size=32", "conv2d_nchw.cuda", [["TENSOR", [1, 16, 55, 55], "float32"], ["TENSOR", [64, 16, 3, 3], "float32"], [1, 1], [1, 1, 1, 1], [1, 1], "float32"], {}], "config": {"index": 804149, "code_hash": null, "entity": [["tile_f", "sp", [-1, 16, 4, 1]], ["tile_y", "sp", [-1, 11, 5, 1]], ["tile_x", "sp", [-1, 1, 11, 1]], ["tile_rc", "sp", [-1, 4]], ["tile_ry", "sp", [-1, 3]], ["tile_rx", "sp", [-1, 3]], ["auto_unroll_max_step", "ot", 512], ["unroll_explicit", "ot", 0]]}, "result": [[5.8275912136925697e-05], 0, 3.945467948913574, 1688498524.8951347], "version": 0.2, "tvm_version": "0.11.dev0"}
{"input": ["cuda -keys=cuda,gpu -arch=sm_89 -max_num_threads=1024 -thread_warp_size=32", "conv2d_nchw.cuda", [["TENSOR", [1, 16, 55, 55], "float32"], ["TENSOR", [64, 16, 3, 3], "float32"], [1, 1], [1, 1, 1, 1], [1, 1], "float32"], {}], "config": {"index": 1460945, "code_hash": null, "entity": [["tile_f", "sp", [-1, 16, 4, 1]], ["tile_y", "sp", [-1, 1, 1, 1]], ["tile_x", "sp", [-1, 1, 1, 55]], ["tile_rc", "sp", [-1, 4]], ["tile_ry", "sp", [-1, 3]], ["tile_rx", "sp", [-1, 1]], ["auto_unroll_max_step", "ot", 0], ["unroll_explicit", "ot", 1]]}, "result": [[0.0016493018517382413], 0, 3.701859951019287, 1688498527.8512251], "version": 0.2, "tvm_version": "0.11.dev0"}
{"input": ["cuda -keys=cuda,gpu -arch=sm_89 -max_num_threads=1024 -thread_warp_size=32", "conv2d_nchw.cuda", [["TENSOR", [1, 16, 55, 55], "float32"], ["TENSOR", [64, 16, 3, 3], "float32"], [1, 1], [1, 1, 1, 1], [1, 1], "float32"], {}], "config": {"index": 959962, "code_hash": null, "entity": [["tile_f", "sp", [-1, 8, 2, 1]], ["tile_y", "sp", [-1, 1, 5, 1]], ["tile_x", "sp", [-1, 11, 1, 5]], ["tile_rc", "sp", [-1, 16]], ["tile_ry", "sp", [-1, 1]], ["tile_rx", "sp", [-1, 1]], ["auto_unroll_max_step", "ot", 1500], ["unroll_explicit", "ot", 0]]}, "result": [[0.0007473931331786543], 0, 5.975722551345825, 1688498530.8296914], "version": 0.2, "tvm_version": "0.11.dev0"}
{"input": ["cuda -keys=cuda,gpu -arch=sm_89 -max_num_threads=1024 -thread_warp_size=32", "conv2d_nchw.cuda", [["TENSOR", [1, 16, 55, 55], "float32"], ["TENSOR", [64, 16, 3, 3], "float32"], [1, 1], [1, 1, 1, 1], [1, 1], "float32"], {}], "config": {"index": 440550, "code_hash": null, "entity": [["tile_f", "sp", [-1, 1, 2, 4]], ["tile_y", "sp", [-1, 1, 1, 11]], ["tile_x", "sp", [-1, 5, 11, 1]], ["tile_rc", "sp", [-1, 1]], ["tile_ry", "sp", [-1, 1]], ["tile_rx", "sp", [-1, 1]], ["auto_unroll_max_step", "ot", 512], ["unroll_explicit", "ot", 0]]}, "result": [[0.0003505905723584291], 0, 3.8741328716278076, 1688498533.770918], "version": 0.2, "tvm_version": "0.11.dev0"}
{"input": ["cuda -keys=cuda,gpu -arch=sm_89 -max_num_threads=1024 -thread_warp_size=32", "conv2d_nchw.cuda", [["TENSOR", [1, 16, 55, 55], "float32"], ["TENSOR", [64, 16, 3, 3], "float32"], [1, 1], [1, 1, 1, 1], [1, 1], "float32"], {}], "config": {"index": 574295, "code_hash": null, "entity": [["tile_f", "sp", [-1, 1, 4, 8]], ["tile_y", "sp", [-1, 1, 5, 1]], ["tile_x", "sp", [-1, 1, 11, 5]], ["tile_rc", "sp", [-1, 2]], ["tile_ry", "sp", [-1, 3]], ["tile_rx", "sp", [-1, 1]], ["auto_unroll_max_step", "ot", 512], ["unroll_explicit", "ot", 0]]}, "result": [[2.3403160465973604e-05], 0, 3.5422329902648926, 1688498536.6695316], "version": 0.2, "tvm_version": "0.11.dev0"}
